{
  "$schema": "https://json-schema.org/draft/2020-12/schema",
  "$id": "ithina.dis.contracts.pubsub.quarantine.v1",
  "title": "quarantine",
  "description": "Published when a chunk or row fails validation at any stage of the pipeline. Producers: streaming-consumer (source-shape, normalization, canonical-shape, FK failures), receivers (preflight failures). Consumed by quarantine-drainer, which persists to the quarantine schema in Cloud SQL for tenant and ops viewing via dis-ui-server.",
  "type": "object",
  "required": [
    "schema_version",
    "trace_id",
    "tenant_id",
    "source_id",
    "failure_stage",
    "failure_type",
    "failure_reason",
    "granularity",
    "bronze_ref",
    "gcs_uri",
    "occurred_ts"
  ],
  "properties": {
    "schema_version": {
      "type": "integer",
      "const": 1
    },
    "trace_id": {
      "type": "string",
      "format": "uuid",
      "description": "Trace_id of the chunk being quarantined. Same as the original ingress.ready / ingress.resubmit trace_id."
    },
    "tenant_id": {
      "type": "string",
      "format": "uuid",
      "description": "Internal tenant UUID, identical to Customer Master core.tenants.id and identity_mirror.tenants.tenant_id. Load-bearing identity."
    },
    "store_id": {
      "type": "string",
      "format": "uuid",
      "description": "Internal store UUID. Optional. Present for row-level failures and chunk-level failures where store is known. Absent if the failure occurred before store could be resolved."
    },
    "tenant_display_code": {
      "type": "string",
      "description": "Customer Master's authoritative external code for the tenant (tenants.display_code). Optional in the schema, but producers MUST populate it when publishing. Readability only, never a substitute for tenant_id."
    },
    "store_code": {
      "type": "string",
      "description": "Customer Master's authoritative external code for the store (stores.store_code). Optional; populated when store_id is known and the code is present in Customer Master. Readability only, never a substitute for store_id."
    },
    "source_id": {
      "type": "string"
    },
    "failure_stage": {
      "type": "string",
      "enum": ["preflight", "source_shape", "normalization", "canonical_shape", "fk_check"],
      "description": "Which pipeline stage produced the failure. Preflight is receiver-side; the rest are streaming-consumer stages."
    },
    "failure_type": {
      "type": "string",
      "enum": ["structural", "validation", "type_mismatch", "fk_violation", "mapping_missing", "internal_error"],
      "description": "Category of failure. Used for ops dashboards and tenant-facing display."
    },
    "failure_reason": {
      "type": "string",
      "description": "Human-readable failure description. Tenant-facing text from the validation library when applicable."
    },
    "granularity": {
      "type": "string",
      "enum": ["chunk", "row"],
      "description": "chunk: the whole chunk failed and no rows were processed. row: this is one of N failed rows from the chunk; other rows may have succeeded or also been quarantined."
    },
    "row_index": {
      "type": "integer",
      "minimum": 0,
      "description": "For granularity=row, the index of the failed row within the chunk (0-based). Absent for granularity=chunk."
    },
    "row_hash": {
      "type": "string",
      "description": "For granularity=row, a content hash of the failed row. Used by the drainer for idempotent inserts. Absent for granularity=chunk."
    },
    "bronze_ref": {
      "type": "string",
      "format": "uuid",
      "description": "Foreign key to the bronze row of the chunk."
    },
    "gcs_uri": {
      "type": "string",
      "pattern": "^gs://[a-z0-9-]+/tenant/[0-9a-f]{8}-[0-9a-f]{4}-[0-9a-f]{4}-[0-9a-f]{4}-[0-9a-f]{12}/source/[^/]+/yyyy=[0-9]{4}/mm=[0-9]{2}/dd=[0-9]{2}/[^/]+\\.(csv|json)$",
      "description": "GCS URI of the original payload. Same as the ingress event's gcs_uri; the tenant segment is the internal tenant UUID."
    },
    "mapping_version_id": {
      "type": "integer",
      "description": "Mapping version that produced this failure (post-mapping stages only). Absent for preflight and source_shape failures."
    },
    "suite_ref": {
      "type": "string",
      "description": "Pointer to the Pandera suite that produced the failure, when applicable. Format: 'tenant/source/version/suite_name'. Used by dis-ui-server quarantine handler to link to suite documentation."
    },
    "failure_context": {
      "type": "object",
      "description": "Stage-specific details. For Pandera failures: failing column, expected vs actual, sample bad values. For FK failures: which FK, what value. Open structure; consumers project what they need.",
      "additionalProperties": true
    },
    "parent_trace_id": {
      "type": "string",
      "format": "uuid",
      "description": "If the chunk being quarantined was itself a resubmit, the original trace_id. Carried through for lineage display."
    },
    "occurred_ts": {
      "type": "string",
      "format": "date-time",
      "description": "When the failure was detected."
    }
  },
  "additionalProperties": false
}
