{
  "schema_version": 1,
  "trace_id": "f47ac10b-58cc-4372-a567-0e02b2c3d479",
  "tenant_id": "019e5e3c-b5d3-705f-9002-2451c4ca2626",
  "store_id": "019e5f10-2a3b-7c4d-8e5f-6a7b8c9d0e1f",
  "tenant_display_code": "buc-ees",
  "store_code": "buc-ees-0001",
  "source_id": "shopify_pos_v2",
  "failure_stage": "canonical_shape",
  "failure_type": "validation",
  "failure_reason": "Column 'sale_amount' must be >= 0; got -12.50",
  "granularity": "row",
  "row_index": 47,
  "row_hash": "sha256:e3b0c44298fc1c149afbf4c8996fb92427ae41e4649b934ca495991b7852b855",
  "bronze_ref": "a1b2c3d4-e5f6-4a5b-9c0d-1e2f3a4b5c6d",
  "gcs_uri": "gs://ithina-bronze-raw/tenant/019e5e3c-b5d3-705f-9002-2451c4ca2626/source/shopify_pos_v2/yyyy=2026/mm=06/dd=04/f47ac10b-58cc-4372-a567-0e02b2c3d479.csv",
  "mapping_version_id": 7,
  "suite_ref": "019e5e3c-b5d3-705f-9002-2451c4ca2626/shopify_pos_v2/v7/canonical_shape",
  "failure_context": {
    "column": "sale_amount",
    "expected": ">= 0",
    "actual": -12.50,
    "check_name": "non_negative"
  },
  "occurred_ts": "2026-06-04T14:32:45.891Z"
}
